{
  "description": "The Dublin Core part is present but truncated mid-object, so it is not well-formed JSON. A syntax error, NOT a duplicate key — a duplicate key in any part is the state-invariant REJECT (§5.4.3), a different row. WARNING in draft/review.",
  "layer": "document",
  "requires": [
    "container",
    "document"
  ],
  "clause": "Metadata section 3; State Machine section 5.4.2",
  "recipe": {
    "entries": [
      {
        "name": "manifest.json",
        "text": "{\"cdx\":\"0.1\",\"id\":\"pending\",\"state\":\"draft\",\"created\":\"2025-01-10T08:00:00Z\",\"modified\":\"2025-01-10T08:00:00Z\",\"content\":{\"path\":\"content/document.json\",\"hash\":\"sha256:5d69e5acc01e8b76df35531f9199eda7f594a972eec7d5718071842062fb39cc\"},\"metadata\":{\"dublinCore\":\"metadata/dublin-core.json\"}}"
      },
      {
        "name": "content/document.json",
        "text": "{\"version\":\"0.1\",\"blocks\":[]}"
      },
      {
        "name": "metadata/dublin-core.json",
        "text": "{\"version\":\"1.1\",\"terms\":{\"title\":\"Truncated\",\"creator\":\"A. Author\""
      }
    ]
  },
  "expect": {
    "documentDisposition": {
      "atLeast": "WARNING",
      "atMost": "WARNING"
    },
    "findings": [
      {
        "code": "CDX-E-METADATA-PART-UNPARSEABLE",
        "atLeast": "WARNING",
        "atMost": "WARNING"
      }
    ]
  }
}
