{
  "description": "A `link` mark whose `href` is the Content Anchor URI `#nope`, which names no block or anchor id in the document. A core anchor is part of the document's addressing layer, so a dangling one is an internal-consistency failure of signed content — WARNING in draft/review, escalating to INTEGRITY-ERROR once frozen (Anchors & References §7.2; deferred to B3).",
  "layer": "document",
  "requires": [
    "container",
    "document"
  ],
  "clause": "Anchors and References sections 2.1, 7.2; State Machine section 5.4.2",
  "recipe": {
    "entries": [
      {
        "name": "manifest.json",
        "text": "{\"cdx\":\"0.1\",\"id\":\"pending\",\"state\":\"draft\",\"created\":\"2025-01-10T08:00:00Z\",\"modified\":\"2025-01-10T08:00:00Z\",\"content\":{\"path\":\"content/document.json\",\"hash\":\"sha256:ec454fc0d085d72cc6491e44f043199197a9bad16b0ad531d2fd956976e68b57\"},\"metadata\":{\"dublinCore\":\"metadata/dublin-core.json\"}}"
      },
      {
        "name": "content/document.json",
        "text": "{\"version\":\"0.1\",\"blocks\":[{\"type\":\"paragraph\",\"children\":[{\"type\":\"text\",\"value\":\"see\",\"marks\":[{\"type\":\"link\",\"href\":\"#nope\"}]}]}]}"
      },
      {
        "name": "metadata/dublin-core.json",
        "text": "{\"version\":\"1.1\",\"terms\":{\"title\":\"Dangling Anchor\",\"creator\":\"A. Author\"}}"
      }
    ]
  },
  "expect": {
    "documentDisposition": {
      "atLeast": "WARNING",
      "atMost": "WARNING"
    },
    "findings": [
      {
        "code": "CDX-E-ANCHOR-DANGLING",
        "atLeast": "WARNING",
        "atMost": "WARNING"
      }
    ]
  }
}
