{
  "description": "A well-formed minimal draft document: manifest, content and Dublin Core parts all present and strict-JSON-parseable. Nothing blocks it.",
  "layer": "document",
  "requires": [
    "container",
    "document"
  ],
  "clause": "Manifest section 3; State Machine section 5.4.2",
  "recipe": {
    "entries": [
      {
        "name": "manifest.json",
        "text": "{\"cdx\":\"0.1\",\"id\":\"pending\",\"state\":\"draft\",\"created\":\"2025-01-10T08:00:00Z\",\"modified\":\"2025-01-10T08:00:00Z\",\"content\":{\"path\":\"content/document.json\",\"hash\":\"sha256:5d69e5acc01e8b76df35531f9199eda7f594a972eec7d5718071842062fb39cc\"},\"metadata\":{\"dublinCore\":\"metadata/dublin-core.json\"}}"
      },
      {
        "name": "content/document.json",
        "text": "{\"version\":\"0.1\",\"blocks\":[]}"
      },
      {
        "name": "metadata/dublin-core.json",
        "text": "{\"version\":\"1.1\",\"terms\":{\"title\":\"Minimal Draft\",\"creator\":\"A. Author\"}}"
      }
    ]
  },
  "expect": {
    "documentDisposition": {
      "atLeast": "IGNORE",
      "atMost": "IGNORE"
    },
    "findings": []
  }
}
