{
  "description": "A core string mark (`bold`) carried as an object `{type:\"bold\"}`. A core mark is valid only as a bare string, so the object form is a structurally malformed known mark — WARNING.",
  "layer": "document",
  "requires": [
    "container",
    "document"
  ],
  "clause": "Content Blocks section 5.1; State Machine section 5.4.2",
  "recipe": {
    "entries": [
      {
        "name": "manifest.json",
        "text": "{\"cdx\":\"0.1\",\"id\":\"pending\",\"state\":\"draft\",\"created\":\"2025-01-10T08:00:00Z\",\"modified\":\"2025-01-10T08:00:00Z\",\"content\":{\"path\":\"content/document.json\",\"hash\":\"sha256:484382880d4666b2e49af6e3209ae872070e02c2c19baf6eab33049f1d75df8d\"},\"metadata\":{\"dublinCore\":\"metadata/dublin-core.json\"}}"
      },
      {
        "name": "content/document.json",
        "text": "{\"version\":\"0.1\",\"blocks\":[{\"type\":\"paragraph\",\"children\":[{\"type\":\"text\",\"value\":\"x\",\"marks\":[{\"type\":\"bold\"}]}]}]}"
      },
      {
        "name": "metadata/dublin-core.json",
        "text": "{\"version\":\"1.1\",\"terms\":{\"title\":\"String Mark As Object\"}}"
      }
    ]
  },
  "expect": {
    "documentDisposition": {
      "atLeast": "WARNING",
      "atMost": "WARNING"
    },
    "findings": [
      {
        "code": "CDX-E-MARK-MALFORMED",
        "atLeast": "WARNING",
        "atMost": "WARNING"
      }
    ]
  }
}
