{
  "description": "A valid archive preceded by a self-extracting-stub prefix (offsets relative to the archive proper) still reads cleanly; a reader that trusts the declared central-directory offset blindly would mis-parse it.",
  "layer": "container",
  "requires": [
    "container"
  ],
  "clause": "Container Format sections 3.1, 3.5",
  "recipe": {
    "entries": [
      {
        "name": "manifest.json",
        "text": "{\"cdx\":\"0.1\",\"state\":\"draft\"}"
      },
      {
        "name": "content/document.json",
        "text": "{\"version\":\"0.1\",\"blocks\":[]}"
      },
      {
        "name": "metadata/dublin-core.json",
        "text": "{\"version\":\"1.1\",\"terms\":{\"title\":\"T\"}}"
      }
    ],
    "prependBytes": 64
  },
  "expect": {
    "documentDisposition": {
      "atLeast": "IGNORE",
      "atMost": "IGNORE"
    },
    "findings": []
  }
}
