{
  "description": "An unknown namespaced block whose children contain a would-be bare block. Because an unknown namespaced block is IGNORE (render a fallback), the reader does NOT interpret its interior as CDX content — so the inner bare block is NOT rejected and the document is IGNORE, not REJECT.",
  "layer": "document",
  "requires": [
    "container",
    "document"
  ],
  "clause": "Content Blocks section 5; State Machine section 5.4.2",
  "recipe": {
    "entries": [
      {
        "name": "manifest.json",
        "text": "{\"cdx\":\"0.1\",\"id\":\"pending\",\"state\":\"draft\",\"created\":\"2025-01-10T08:00:00Z\",\"modified\":\"2025-01-10T08:00:00Z\",\"content\":{\"path\":\"content/document.json\",\"hash\":\"sha256:cf580e4e85fbec037aa314cf07be6b811a14e483eddb264c5e59565b956348da\"},\"metadata\":{\"dublinCore\":\"metadata/dublin-core.json\"}}"
      },
      {
        "name": "content/document.json",
        "text": "{\"version\":\"0.1\",\"blocks\":[{\"type\":\"myorg:widget\",\"children\":[{\"type\":\"itlaic\"}]}]}"
      },
      {
        "name": "metadata/dublin-core.json",
        "text": "{\"version\":\"1.1\",\"terms\":{\"title\":\"Opaque Extension Subtree\",\"creator\":\"A. Author\"}}"
      }
    ]
  },
  "expect": {
    "documentDisposition": {
      "atLeast": "IGNORE",
      "atMost": "IGNORE"
    },
    "findings": [
      {
        "code": "CDX-E-BLOCK-TYPE-UNKNOWN-NAMESPACED",
        "atLeast": "IGNORE",
        "atMost": "IGNORE"
      }
    ]
  }
}
