{
  "description": "The index file's stored bytes (one `size` field edited) do not match the hash the manifest declares for the category. Asset Embedding §8.1 step 3 makes `manifest.assets.<category>.hash` the index's declared hash, and §3.1 makes that one hash the transitive anchor for the whole category. The `manifest.id` here is recomputed over the TAMPERED index text — the bytes that actually enter the id basis — so the fixture isolates the index-hash row instead of also tripping the document-ID row.",
  "layer": "document",
  "requires": [
    "container",
    "document"
  ],
  "clause": "Asset Embedding sections 3.1, 8.1; State Machine section 5.4.2",
  "recipe": {
    "entries": [
      {
        "name": "manifest.json",
        "text": "{\"cdx\":\"0.1\",\"id\":\"sha256:dce9f0d97e1b1b514c435bab0c9d581cb6bccf20aa30e9877837d7e8d7ad34eb\",\"state\":\"review\",\"created\":\"2025-01-10T08:00:00Z\",\"modified\":\"2025-01-10T08:00:00Z\",\"content\":{\"path\":\"content/document.json\",\"hash\":\"sha256:d4f68c68e67a9fff2870e84432e4e7572cc3ff2a8a784522d08298317bf52a4e\"},\"metadata\":{\"dublinCore\":\"metadata/dublin-core.json\"},\"assets\":{\"images\":{\"count\":1,\"totalSize\":62,\"index\":\"assets/images/index.json\",\"hash\":\"sha256:b437c9030604dd9d987bb6d165de2a651d787e251b665e5b13818921af3aba5d\"}}}"
      },
      {
        "name": "content/document.json",
        "text": "{\"version\":\"0.1\",\"blocks\":[{\"type\":\"image\",\"id\":\"img1\",\"src\":\"assets/images/fig1.svg\",\"alt\":\"Figure 1\"}]}"
      },
      {
        "name": "metadata/dublin-core.json",
        "text": "{\"version\":\"1.1\",\"terms\":{\"title\":\"Index Hash Mismatch\",\"creator\":\"A. Author\"}}"
      },
      {
        "name": "assets/images/index.json",
        "text": "{\"version\":\"0.1\",\"assets\":[{\"id\":\"fig1\",\"path\":\"fig1.svg\",\"type\":\"image/svg+xml\",\"size\":63,\"hash\":\"sha256:a5a035f4bdc412baf68e606049b8953e4295f276ce8e014b6e40e72c8e99bb86\"}]}"
      },
      {
        "name": "assets/images/fig1.svg",
        "text": "<svg xmlns=\"http://www.w3.org/2000/svg\" width=\"8\" height=\"8\"/>"
      }
    ]
  },
  "expect": {
    "documentDisposition": {
      "atLeast": "WARNING",
      "atMost": "WARNING"
    },
    "findings": [
      {
        "code": "CDX-E-ASSET-INDEX-HASH-MISMATCH",
        "atLeast": "WARNING",
        "atMost": "WARNING"
      }
    ]
  }
}
