{
  "description": "A review document whose declared `manifest.id` was computed over the title \"Minimal Review\", but whose Dublin Core title is now \"Edited Title\" — the metadata projects into the document ID (Document Hashing §4.3.1), so the recomputed id no longer matches the declared one. Models metadata edited after the id was fixed. The `content.hash` is correct, so only the document-ID finding fires — WARNING in draft/review.",
  "layer": "document",
  "requires": [
    "container",
    "document"
  ],
  "clause": "Document Hashing sections 4.4, 6.3; State Machine section 5.4.2",
  "recipe": {
    "entries": [
      {
        "name": "manifest.json",
        "text": "{\"cdx\":\"0.1\",\"id\":\"sha256:b580ac3b69152f9b2898b03170a58d531b6726a4f6e5ba752c77ab0ad2df0675\",\"state\":\"review\",\"created\":\"2025-01-10T08:00:00Z\",\"modified\":\"2025-01-10T08:00:00Z\",\"content\":{\"path\":\"content/document.json\",\"hash\":\"sha256:5d69e5acc01e8b76df35531f9199eda7f594a972eec7d5718071842062fb39cc\"},\"metadata\":{\"dublinCore\":\"metadata/dublin-core.json\"}}"
      },
      {
        "name": "content/document.json",
        "text": "{\"version\":\"0.1\",\"blocks\":[]}"
      },
      {
        "name": "metadata/dublin-core.json",
        "text": "{\"version\":\"1.1\",\"terms\":{\"title\":\"Edited Title\"}}"
      }
    ]
  },
  "expect": {
    "documentDisposition": {
      "atLeast": "WARNING",
      "atMost": "WARNING"
    },
    "findings": [
      {
        "code": "CDX-E-DOCUMENT-ID-MISMATCH",
        "atLeast": "WARNING",
        "atMost": "WARNING"
      }
    ]
  }
}
