{
  "description": "The manifest references `metadata/dublin-core.json`, but the archive carries no such entry. Distinct from the unreferenced case above: here the document claims metadata and does not ship it, so the id basis is INDETERMINATE (the id was computed over the real terms) rather than empty — WARNING in draft/review.",
  "layer": "document",
  "requires": [
    "container",
    "document"
  ],
  "clause": "Metadata section 3.3; Container Format section 3.3.1; State Machine section 5.4.2",
  "recipe": {
    "entries": [
      {
        "name": "manifest.json",
        "text": "{\"cdx\":\"0.1\",\"id\":\"pending\",\"state\":\"draft\",\"created\":\"2025-01-10T08:00:00Z\",\"modified\":\"2025-01-10T08:00:00Z\",\"content\":{\"path\":\"content/document.json\",\"hash\":\"sha256:5d69e5acc01e8b76df35531f9199eda7f594a972eec7d5718071842062fb39cc\"},\"metadata\":{\"dublinCore\":\"metadata/dublin-core.json\"}}"
      },
      {
        "name": "content/document.json",
        "text": "{\"version\":\"0.1\",\"blocks\":[]}"
      }
    ]
  },
  "expect": {
    "documentDisposition": {
      "atLeast": "WARNING",
      "atMost": "WARNING"
    },
    "findings": [
      {
        "code": "CDX-E-METADATA-PART-MISSING",
        "atLeast": "WARNING",
        "atMost": "WARNING"
      }
    ]
  }
}
