{
  "description": "A range `#p1/9007199254740992-9007199254740993` whose two bounds are DISTINCT integers that round to the same IEEE-754 double. Schema-valid: `contentAnchorUri`'s pattern admits an unbounded `[0-9]+`, and Document Hashing section 4.3.2's 2^53 limit governs hashed NUMBERS, not digits inside a string. A reader deciding `start < end` after converting to a double finds them equal, takes the STRUCTURAL arm, and reports a null-disposition finding — silently downgrading a WARNING that Anchors & References section 7.2 tabulates. The bound must be compared before conversion; the Python oracle uses arbitrary-precision integers and reaches the correct answer either way, so this is a live two-implementation disagreement rather than a shared blind spot.",
  "layer": "document",
  "requires": [
    "container",
    "document"
  ],
  "clause": "Anchors and References sections 2.1, 3, 7.2, 7.3; State Machine section 5.4.2",
  "recipe": {
    "entries": [
      {
        "name": "manifest.json",
        "text": "{\"cdx\":\"0.1\",\"id\":\"pending\",\"state\":\"draft\",\"created\":\"2025-01-10T08:00:00Z\",\"modified\":\"2025-01-10T08:00:00Z\",\"content\":{\"path\":\"content/document.json\",\"hash\":\"sha256:f8195049a7df3e358680581e56690f96df23dac77b7a62b151be9132eec621ca\"},\"metadata\":{\"dublinCore\":\"metadata/dublin-core.json\"}}"
      },
      {
        "name": "content/document.json",
        "text": "{\"version\":\"0.1\",\"blocks\":[{\"type\":\"paragraph\",\"id\":\"p1\",\"children\":[{\"type\":\"text\",\"value\":\"short\"}]},{\"type\":\"paragraph\",\"children\":[{\"type\":\"text\",\"value\":\"see\",\"marks\":[{\"type\":\"link\",\"href\":\"#p1/9007199254740992-9007199254740993\"}]}]}]}"
      },
      {
        "name": "metadata/dublin-core.json",
        "text": "{\"version\":\"1.1\",\"terms\":{\"title\":\"Anchor Position Unsafe Integer\",\"creator\":\"A. Author\"}}"
      }
    ]
  },
  "expect": {
    "documentDisposition": {
      "atLeast": "WARNING",
      "atMost": "WARNING"
    },
    "findings": [
      {
        "code": "CDX-E-ANCHOR-POSITION-OUT-OF-RANGE",
        "atLeast": "WARNING",
        "atMost": "WARNING"
      }
    ]
  }
}
