{
  "description": "A core annotations file whose comment anchors at a block the content does define. The positive control for the out-of-hash anchor row: a reader that resolved annotation anchors against the wrong namespace, or failed to resolve them at all in the clean direction, would emit a spurious WARNING here. CLEAN.",
  "layer": "document",
  "requires": [
    "container",
    "document"
  ],
  "clause": "Anchors and References section 7.2; State Machine section 5.4.2",
  "recipe": {
    "entries": [
      {
        "name": "manifest.json",
        "text": "{\"cdx\":\"0.1\",\"id\":\"pending\",\"state\":\"draft\",\"created\":\"2025-01-10T08:00:00Z\",\"modified\":\"2025-01-10T08:00:00Z\",\"content\":{\"path\":\"content/document.json\",\"hash\":\"sha256:d2da00ccb856ddd6dffab5b12df723d8899316fdde8185bef09f30f901f61acc\"},\"metadata\":{\"dublinCore\":\"metadata/dublin-core.json\"}}"
      },
      {
        "name": "content/document.json",
        "text": "{\"version\":\"0.1\",\"blocks\":[{\"type\":\"paragraph\",\"id\":\"p1\",\"children\":[{\"type\":\"text\",\"value\":\"x\"}]}]}"
      },
      {
        "name": "metadata/dublin-core.json",
        "text": "{\"version\":\"1.1\",\"terms\":{\"title\":\"Resolved Annotation\",\"creator\":\"A. Author\"}}"
      },
      {
        "name": "security/annotations.json",
        "text": "{\"version\":\"0.1\",\"annotations\":[{\"id\":\"a1\",\"type\":\"comment\",\"anchor\":{\"blockId\":\"p1\"},\"author\":{\"name\":\"A\"},\"created\":\"2025-01-10T08:00:00Z\",\"content\":\"ok\"}]}"
      }
    ]
  },
  "expect": {
    "documentDisposition": {
      "atLeast": "IGNORE",
      "atMost": "IGNORE"
    },
    "findings": []
  }
}
