{
  "description": "The manifest references a provenance record by path, and the archive does not contain it. A path-only reference carries no hash, so the target is bound by neither the document hash nor the manifest projection — its absence degrades a layer and can never signal tampering, making this a WARNING in EVERY state (not a deferred escalation).",
  "layer": "document",
  "requires": [
    "container",
    "document"
  ],
  "clause": "Security Extension section 9.8; State Machine section 5.4.2",
  "recipe": {
    "entries": [
      {
        "name": "manifest.json",
        "text": "{\"cdx\":\"0.1\",\"id\":\"pending\",\"state\":\"draft\",\"created\":\"2025-01-10T08:00:00Z\",\"modified\":\"2025-01-10T08:00:00Z\",\"content\":{\"path\":\"content/document.json\",\"hash\":\"sha256:5d69e5acc01e8b76df35531f9199eda7f594a972eec7d5718071842062fb39cc\"},\"metadata\":{\"dublinCore\":\"metadata/dublin-core.json\"},\"provenance\":\"provenance/record.json\"}"
      },
      {
        "name": "content/document.json",
        "text": "{\"version\":\"0.1\",\"blocks\":[]}"
      },
      {
        "name": "metadata/dublin-core.json",
        "text": "{\"version\":\"1.1\",\"terms\":{\"title\":\"Missing Provenance\",\"creator\":\"A. Author\"}}"
      }
    ]
  },
  "expect": {
    "documentDisposition": {
      "atLeast": "WARNING",
      "atMost": "WARNING"
    },
    "findings": [
      {
        "code": "CDX-E-PART-MISSING-UNBOUND",
        "atLeast": "WARNING",
        "atMost": "WARNING"
      }
    ]
  }
}
